msg_id,user_id,message
504317035011391489,1068405596,"""I'd rather kill myself than commit suicide"" wait what"
500027584713719808,621232441,"In the wake of Robin Williams death, mental health is being revisited... Read more here: http://LINK"
500182614766931969,1460051365,Comedy great Robin Williams hanged himself at home - Flowers Robin... http://LINK
470448597033836544,454265504,LOL @ the fact I just ran into my brothers ex girlfriend who kicked him out and allowed him to be homeless for 8 months #rotinhell #bitch
641807657670680576,417329435,My abs are so close yet so fucking far away. #goals
502136230364995584,2646696260,"""you telling people with addiction and depression to kill their self bad move gene simmons.when i""  Wanda Smith http://LINK"
499727155493097472,2444923868,#USAHeadlines UPDATE 6-Comedy great Robin Williams hanged himself at home  Reuters http://LINK
437622121561223169,775819368,@SOMEONE my favs Nocturnal depression -Her ghost haunts these walls Make a change Kill Yourself -life revisited
473527599621099520,17481279,distracted from keynote reading ryan chamberlain's suicide note/twitter update. Know that feeling. I wonder how much of pressure was govt.
564414240673775618,391369921,#Mind-body #Health: #psychiatry &amp; #depression: #research suggesting #diet &amp; #nutrition of substantial relevance to #mood and #behaviour....
410495927879598080,161600560,I hate it when people start hitting me up for jays 
499000756452999168,48798787,I don't care if it was a joke...thats some fuckin dumb ass shit to play about...I hope your mother commits suicide...then we'll make a joke.
484405308874190848,2346338792,Iran: w#oman commits suicide by hanging http://LINK
635519256457711616,2476115360,@SOMEONE i just watched all of your bo3 gameplays and holy fuck it feels like youre using a mouse
498993042167042051,16554333,@SOMEONE ugh so sad. he was recently in rehab too. the twin cocktail of drugs&amp;depression is probably our greatest public health threat :(
551222419390623744,1190205696,Mentally Ill Rikers Island Inmate Who Hanged Himself Was Supposed To Be On Suicide Watch http://LINK
447777052641329152,315037581,"A muslim believes he is weak bec he knows that, happy or sad, he needs to seek help from ALLAH The Almighty hihi ^^"
358761682153127936,277421038,Thank god tho. I hate it when it's slow.
671039273731256323,791218008,@SOMEONE she kept sayin how surprised she was that i wasn't hitting on her n im just like ohhh i really wanna trust me 
484387015367352320,7989192,"""8 Afghan Air Force Officers Killed in Suicide Attack in Kabul"" by AZAM AHMED and JAWAD SUKHANYAR via NYT The Ne... http://LINK"
551999964839424001,17183476,#French man found hanging from balcony on #KohTao #Thailand - hands tied behind back http://LINK
427637808967471104,566577044,@SOMEONE WHY DO I HATE MYSELF
498997086428626945,1058646950,R.I.P robin Williams you will be sadly missed :( but you will be remembered for being the happy cheerful man you always was :'(
513303232907837441,466088644,"Where does all my enemies judges, lawyers, detectives, police officers, and others having license to murder get their permission to kill"
360399532862865411,63845667,My mom was talking shit about my kitty &amp; I meant to say I fuckin love him but accidentally said I love fucking him. Awkward
499122284452663296,1275137971,RIP Robin Williams. Reach out to the people you know who battle depression because it really can kill. Support mental health charities.
642847581119361024,505828968,@SOMEONE guy is burn this mother fucker to the ground! Best thing to hit Michigan this year!
445986446499790848,140510422,@SOMEONE OKAY THIS IS FUCKING UNFAIR IF YOU DONT GET ME TICKETS IM GONNA GO INTO DEPRESSION http://LINK
705023664304033796,2694256117,"Some strong points go to Max, just Max as a character. Fucking loved that little shit. Perfect successor to michelle"
543778789965062144,560216420,The FBI is investigating the hanging death of a black teenager in North Carolina previously ruled a suicide. http://LINK
537621247526727680,998009144,Life is about constant re-invention and adapting to change. Fuck suicide as a retirement option.
705218720835215362,257773838,"""hate when girls post a snapchat with the dog filter"" oh well  @ Who Let The Dogs Out? http://LINK"
705970690290262016,1918445090,"Na I'm good fuck that, always"
620474370528448512,636682753,"@SOMEONE never was in school. I'd pull up at school like, ""I'm about to go over kaylah's and go right back to sleep."" Fuck school"
704834925489475584,308019790,"""Dude. We are so fucked.""- a bro who, even though his stereotype is that he's an idiot (and is), he still knows how bad it is #SuperTuesday"
628091451763654656,711818084, i would of killed them http://LINK
510398242052644864,38786033,Photo: thisplaceisaliving-hell: B&amp;W depression blog http://LINK
507864410279272451,422587260,"WHO: One suicide is committed every 40 seconds: Every 40 seconds someone in the world takes their own life, a ... http://LINK"
666381481464459268,452553250,"Thought I hated Justin Bieber but there isn't one new song of his I don't like, alright JB I see you."
498980958444748801,20097362,Marin County Sheriff's Office says it appears Robin Williams took his own life. Full coverage up next at 5. Watch: http://LINK
499187599396044800,114431945,It's just such a big deal. Robin Williams is gone! He left. Left us all to it. I miss him.
562044956416569345,132782052,Did everyone making commercials this year have a meeting together and decided were going to give the entire nation depression?
470170599181262848,132818820,The art of sales suicide - Recent Blog - Nick Baldock http://LINK
435449644055670788,404399789,Drove for an hour on the highway with the window fucked up deff getting sick
498980072754540544,2191822547,"RIP Robin Williams, i still cant believe it... we will miss you:'("
422893584900055040,568694265,Everything that kills me makes me feel alive
565233830559514624,40298762,Both cancer and depression just really hit me right in the feels.
526054239131299840,198646850,Suicide attack kills 8 Shiite militiamen in Iraq http://LINK
502814720949092352,2754942752,I wish depression was talked about more openly and seriously at school because I feel like that could help save lives.
555743213274009601,1318632763,"English bulldogs are honestly precious dogs, but we've mutilated them to the point of having so many health problems it's not fair."
624266491479859201,2946665317,When a bitch realize she can't fuck with u 
613503760497803264,292604111,@SOMEONE Hi Girlfriends! I filled out an app at AVN who should I contact to let them know I'm coming to LA again? xo Maxine X Thank u
543578958189457408,1645080612,"After North Carolina teen's hanging ruled a suicide, FBI opens inquiry http://LINK"
484377795376594944,2362365049,Iran: w#oman commits suicide by hanging http://LINK
537300468041396224,2807029784,Nigeria: 2 female bombers kill 30 in Maiduguri: Two teenage female suicide bombers blew themselves up Tuesday ... http://LINK
499286615463051264,43831704,Robin Williams hanging himself really makes me sad. That's one of the most disturbing pictures in can imagine.
532910216233639937,50890679,I won't admit how many times I've listened to Blank Space. But it's on the borderline of needing to seek help. #TaylorSwift #obsessed
562584355730882561,32073782,Off to the gym. #blackdog #depression #recovery #selfcare #self #care #therapy #mental #health #boxing http://LINK
462964090043125760,184968412,Foto: just-a-scratch-just-a-scar: Man Overboard // How To Hide Your Feelings bands/depression blog http://LINK
499027072665137152,2697438224,RIP Robin Williams!!!!!! The entire world will miss you dearly!!!!
499432366104780800,1648964377,@SOMEONE Apple posts Robin Williams tribute page to company website http://LINK
487016200464252928,33997733,@SOMEONE Thank you so much for buzzfeed about depression. You were spot on. It's very helpful to identify those feelings with others.
705923717419900928,1523141006,"I hate all these ppl who be actin like they feel sorry for Ciara, she admitted she used to love hood niggas in her music "
520270859160649728,1394401363,"60-year-old woman commits suicide in Ondo: A 60-year-old woman, Deborah Lawani, has committed suicide by hangi... http://LINK"
499727843753205761,461605858,"Riverbend Community Mental Health, Inc.'s photo. To a great actor and thoughtful person, rest in peace Robin Williams. 1 in 4 people..."
537840340578099200,105903931,"Photo: smilethroughtears96: ""No one commits suicide because they want to die; they do it because they want... http://LINK"
534823116971978753,378676320,Suicide and suicidal thoughts affect more people than some think and if you're insensitive enough to make jokes out of it you're disgusting
498983129101922304,147454788,@SOMEONE Suicide is for pussies.... U don't deserve to be praise for being a coward and ending your life What the fuck asshole
530373903785689088,92567309,On the outside you look fine but on the inside could be killin' you act like a comedian but now you robin Williams
613110658176024580,320529449,"I hate talking on the phone, and especially to those who take 20 min. to say what could have been said in 5. Make your point, and hang up!"
499278211164164096,2667707252,just goes to show even famous people with so much going for them can take their own lives we were bought up on robin williams films so sad
561911335504445441,607305339,"And then my brother said ""maybe this is why you can't find a boyfriend?!"" #thanksjay "
438998426361929729,1424710304,"""I can feel it consuming me up every second"" ""honey that's how depression feels like"""
623999000597954560,423090357,Biggest decision of my life and it got me all types of fucked up
438794675508740096,132390780,Foto: be-cutfree-and-hope: Follow a depression blog with a little pinch of happiness. http://LINK
507809353886232576,1739459209,"Suicide: Every 40 seconds someone in the world takes their own life, a global tally of more than 800,000 suici... http://LINK"
530245035477200896,32680530,"@SOMEONE @SOMEONE @SOMEONE you need to be put in a mental institution you're psychotic, just seek help. I'm done here."
501712074079485952,1054958480,How the fuck do people get hold of pictures like this  robin Williams after he had been found hung http://LINK
457719997557530624,38652595,Suicide risk a concern: South Korean officials have made mental health counselors available to the families of... http://LINK
705097543047229440,502340350,"Interested in a #Healthcare #job near #JerseyCity, NJ? This could be a great fit: http://LINK"
704870235128602624,458140304,Wine not ... Take a crazy chance ! New up on the blog ! http://LINK
382684912597602304,469466665,"""I'M NOT A FUCKING TRICYCLE AARON!"" @SOMEONE"
612045487886069760,2240696180,When Life Gives You Thots Fuck Em 
432955180355969024,589418853,Why can't I just go on a cruise 
548219160879443968,219687233,"Treble's post in Depression, Mental Health Advice, and Support http://LINK"
704491419835232256,256352051,#KyrieIrving once again getting lit up because he doesn't play defense but runs his mouth to the media. Do your fucking job
497322309926256640,535157239,Photo: scntrx: Depression Blog http://LINK
645651427327655936,584232488,@SOMEONE No fuckin way where
502487448937447424,2748646543,Dave's Blog: Robin Williams - Free thinker http://LINK
446115491778539520,572012512,"+ CAN BE. YOU ARE SO SPECIAL. AND TBH I SEE A THERAPIST AND I TAKE DEPRESSION MEDS, I KNOW HOW IT FEELS. IM ALWAYS HERE FOR YOU GUY IM JUST+"
633409225205518336,412810832,Where the fuck Alpena Township doe
505566882322055169,2249461819,"Having negative friends is linked to depression, lowered self esteem, insomnia and anxiety. Positive friends promote good overall health."
445657217031610368,1075556713,"08:44:46 SUICIDE-ATTMPT,THREAT,OVERDOSE 700 S COLLEGE AVE ADV APT 2"
492396531677278208,1562271566,"Suicide doesn't end the pain, it passes to the ones you love and remains."
442461500595503104,302317368,having post concert depression so bad. @SOMEONE &amp; @SOMEONE I miss you guys
491345092955742208,1511543318,"Just like other illnesses, depression can be treated so that people can live happy, active lives.-Tom Bosley"
494289812829245440,1623232148,@SOMEONE She was bullied for taking picture with u and tried to commit suicide! He needs u #AvrilPleaseHelpDebb http://LINK
467050879078526976,294325374,I hate when I've just been doing so good with my moods &amp; I'm just like a slingshot snapping back into depression ugh :(
563506316124356608,2996698643,@SOMEONE wow this guy is off his trollie!! You are not right matey! You need to seek help! #police #breakdown #hospital
705071261987282945,2587014236,"I fucking HATE copycats. You are allowed to steal, not to copy get it?"
600788886625869824,2582597192,I love when my coworkers are fuckin rude to me for no good reason :')
498980719524605952,628490179,@SOMEONE Cut 4 robin williams so he comesback alive http://LINK
499408510354870272,324670614,Williams death confirmed as suicide: US actor and comedian Robin Williams had been treated for depression and took his own life at hi...
705440593716109312,59633836,How'd I go to a test where you could use a cheat sheet and not have a fucking cheat sheet????
621911509556269056,317097635,"He just looks at them and he turns to me like ""Why she keep looking at me?"" http://LINK"
485070362385059840,372938368,Fuck this typo shit keep fucking up my tweets!!!!
552295108750888960,2322618001,Dear depression and social anxiety: Fuck you.
451076102015176704,2391510491,"RT""@SOMEONE Will you shut the fvck up?! ""@SOMEONE Aii there I failed again! Am fucked! Suicide is seriously an option!"""""
500346344138362880,707213869,"@SOMEONE my nephew committed suicide yesterday, he left behind 3 small children and an amazing wife.."
386896671386652672,378768464,@SOMEONE  you're killing me right now with these tweets #hilarious
538990504377974785,44494953,@SOMEONE how else do you stay relevant when your magnum opus is fucking Depression Quest?
706114443009101824,22057641,"BAYADA Home Health Care: Certified Home Health Aides (#FarRockaway, NY) http://LINK"
439157296619601920,542912158,RT @SOMEONE #Depression &amp; #DisorderedEating can go hand in hand. Need help? Take a self-assessment: http://LINK
448982362005569536,195850284,"@SOMEONE depression. You should know how it feels, and you should be sympathetic."
667048888294055936,1244608176,@SOMEONE Refugees who r women can kill more of us with suicide vest!
704348044708327425,278717575,"343 Service men and women were killed rescuing over 25,000 people on September 11, 2001. The http://LINK"
439589350234267648,1708833553,I just had one of the most racist experiences ever in a restaurant just a few minutes ago. I'm not even that brown? #fuckracism
664921332925075456,21237679,GOT Many HATE Twitters from Afro-Americans who Anti-Latino Hatred on White&amp;Black Campus is OK.Not on BLACKS http://LINK
633655472743153664,2895321397,I hate my daddy but whenever I need him there he always there for me
624458325221109760,572081254,@SOMEONE what the fuck is the 6 for?!
542563318696013825,2480923244,@SOMEONE are you trying to kill me
706686867035525120,547930103,"Along the way, you meet pretty cool people :) Been hanging with Juliana since the first day at http://LINK"
470759554196987904,1616997456,Hunting the web to get another posting related to depression which i could put up on my blog and I found this on... http://LINK
646134570363043840,612871640,mark playing I Am Bread: oh god i hate it mark: why mark: why mark: why
444003323335548928,335411381,A friend of mine has left this world to soon...I will miss him...for one brief moment he must have felt all alone...suicide is always rough
522899765936156672,1863957678,War Machine -- Attempts Suicide by Hanging in Jail http://LINK
705195999145361408,257290281,It's fucking ladrillo out side
515636991187513345,296599722,Walking off depression and beating stress outdoors? Nature group walks linked to improved mental health http://LINK
499392762710876161,171988291,If we don't see TV networks running a whole bunch of Robin Williams movies soon they're missing out on low hanging fruit.
450105887948959744,462516939,"1,892 US #veterans have committed #suicide since January 1st of THIS YEAR. http://LINK"
636271907466256384,2157735834,@SOMEONE if men were more honest with the women they were fucking there wouldn't be trust issue having women but men to dumb to realize..
526761663169826817,1621622551,thinking about gabe's suicide and then her suicide attempt today &amp; i just wanna let yall know it is a-ok to ask for help yung homiez
437255308273278977,35272731," ""@SOMEONE Depression sufferers often put on brave faces. Charlotte Dawson we will miss you. #CharlotteDawson"""
654713187640606720,461351207,@SOMEONE Amen! I can't believe in the21st century we're still killing.
534386707190542336,1005523795,Bristol may be open by the end of the month.. If It would quit raining and just snow
623700288902418432,2322496766,When the fuck am I going to stop crying over the SAME FUCKING THING
537443434584629248,2342848735,"Please do not use depression as if it's an emotion. It's a disorder, not a dang emotion. You don't feel depression, you have it."
557446005478924288,267085301,"@SOMEONE I definitely have Clinomania, I need to seek help for it!"
525197515369357312,403438443,#LameApocalypses @SOMEONE Hipsters all want to die before it becomes cool leads to mass suicide in small Jersey coffee shop
498988310757670912,63333154,RIP Robin Williams. One of the funniest in the business and will be missed by many. Thank you for many many laughs.
456610652996386816,274160685,"Gettin 5,000 calories a day out of healthy food is a struggle"
498969776325402624,748483669,@SOMEONE Devastated. Robin Williams was a personal hero of mine. Gonna miss him a lot. OMFG NOOO
469731829650849792,71504089,Photo: dropkiddead: B&amp;W depression/Band Blog. http://LINK
438016283909423104,579163957,San Jose: Death at Oakridge Mall investigated as apparent suicide: A woman died Sunday afternoon afte... http://LINK
505570092449423361,2512908643,"Having negative friends is linked to depression, lowered self esteem, insomnia and anxiety. Positive friends promote good overall health."
555550054078234624,637153703,heartshapedhappymeal: mysoulisinorbit: jemmasimmns: please dont make people with depression feel guilty... http://LINK
474649917169082368,126424857,"@SOMEONE Over eating causes a feeling of depression, emotional attachment to food, fatigue, and even boredom.current feels"
634415344803692544,190401970,A fucking plea deal?! You got to be kidding me. http://LINK
499281759096553472,15736836,Official: Robin Williams hanged himself with belt http://LINK
396636021162405888,635169156,"my fucking right cheek is pink, thanks a lot guy! fuckin faggot"
536223273697435648,763173199,"people who commit suicide don't want to end their life, they want to end the pain, bullying, hating, anger and feeling unloved and unwanted"
456581700038836227,65953400,"If you fail at committing suicide, do you appreciate life or feel like a failure?"
429235895280353280,542965663,"When I get bored tonight I'll just scroll through twitter, all the drama from the North/South game is like reading a tabloid newspaper lol"
499506779273711616,194390867,#LatestInfo: Robin Williams Confirmed Dead From Suicide By Hanging: Robin Williams was found dead in his bedro... http://LINK
410411181094879232,231215308,My boyfriend good morning was  I love him
447924439305310208,183332877,At the end of day I'm  and all ya bitches fake 
506104139835650048,2750921997,@SOMEONE it's true though. One of my best friends had a friend that commited suicide and she got over that after a year.
621798437957320704,2949337971,Like shut up and wait for mom so we can go out to eat
499284127452250112,635152976,"Photo: Rest in peace Robin Williams, a fellow pug lover.  Depression and mental health issues are very... http://LINK"
444958660218068992,2260773187,"""Why do you want to shut out of your life any uneasiness, any misery, any depression, since after all..."" http://LINK"
490582491359875072,25473911,Father of missing Oakland toddler Daphne Webb commits suicide | http://LINK
662859477008424960,576217812,Dawggg wut he killed it ! http://LINK
499333027378393088,359993971,"Robin Williams, Oscar Winner, Dies After Hanging Himself http://LINK"
545549320934526978,126430870,via @SOMEONE Suicide: A doctors story http://LINK
357237769812189185,379809139,Time to start eating healthy again i hope @SOMEONE is ready
499191528472858624,593007996,"BEST OF THE WEB: Remembering Robin Williams: Fellow comics, actors and fans react to the news of Robin Williams... http://LINK"
497798228713041920,2589523584,"Acts 29 Removes Mars Hill, Asks Mark Driscoll To Step Down and Seek Help http://LINK"
529010596889767937,2193160665,@SOMEONE @SOMEONE @SOMEONE Yes I know.. Also I was police witness at Coroners court for insulin overdose suicide. #McCann
462433509593075713,47214674,Photo: kiss-her-wrists13: Trigger warning.Black and white self harm/depression blog. I offer advice and... http://LINK
446887930070843392,2391705942,"RT if you are here for me when i need someone to talk to, someone to talk to about my selfharm and depression problems."
619005549129170944,245974088,You know what I hate? I hate always winning
425332755233120256,371851034,Let no man pull you low enough to hate him
443858652789624832,408902268,"@SOMEONE and gun ownership is a health issue...those with guns in the home far more likely to have accidental shootings/suicide, etc"
498967861302665217,331068420,"Today I got stung by a jellyfish AND Robin Williams died. Srsly, this day can't get any worse. #mrsdoubtfire"
493578563753230337,58111254,I may need to seek help with my rock hoarding issues. How many shoes boxes and bags of rocks are too many?
510574009361375232,251718665,@SOMEONE @SOMEONE talk to any suicide group in the uk or Ireland and come back to me with some of that humility.
361647299765600256,374259313,Hopefully tomorrow morning I can wake up and my ex boyfriends car won't be in my driveway  thanks dad!
425122688768552960,419753670,@SOMEONE hatin hard on hicks tonight
499287555301339136,244317966,Sheriff's Official: Actor Robin Williams Hanged Himself: Law enforcement authorities say American actor-comedian... http://LINK
499785085986422785,468112834,@SOMEONE @SOMEONE Thanks for cheering me and giving me great advice. Thank you for talking sense into me when I wanted to suicide.
481486073093423104,373501565,@SOMEONE @SOMEONE Cad Da Fuckin Barber SayDaat  Barber ass niggas !
559950767079964672,1566584449,IM FUCKING SUICIDAL I NEED HELP SOMEONE GIVE ME THE SUICIDE PREVENTION NUMBER ASAP
642719374336499712,3039606208,I fucks wit jackson that bitch str8 
560556021848891395,90794392,"I struggle with really bad depression, so it's great to see people who care about mental health here #BellLetsTalk"
499344296189759488,205511066,"Robin Williams hanged himself, sheriff says #Chicago http://LINK"
489431021587140608,319676606,the fuckery in my inbox 
499375785933688832,48220779,:( RT @SOMEONE Comedy great Robin Williams hanged himself at home http://LINK
618436751401611264,2582732908,S/o to the @SOMEONE for stealing my money and hanging up on me everytime I try to get it back.
467324043973386242,1196792850,Mental health awareness week is ending. Big up @SOMEONE &amp; @SOMEONE for their ace work on this. If you're struggling please seek help.
517796061633843200,243880257,Robin Williams really died 50 days ago got damn where the time going
407641842566856704,1539628968,What world do we live in when someone is shot and killed over a fucking PS4... http://LINK
499275686293803008,273378705,@SOMEONE Robin Williams Found by Assistant Hanged to Death at California Home: Sheriff's Official http://LINK
499034931235160064,2720823634,@SOMEONE RIP Robin Williams @SOMEONE i will miss him he was once from the best comedian ever..it shocked me
501300761675182080,38149209,Terry Jones shuts down rumours that Robin Williams hadn't completed work on new Monty Python film Absolutely Anything http://LINK
498993659866791937,470335262,"Got home from soccer to find out Robin Williams has died, what a way to end my day. #RIPRobinWilliams You will be missed."
450748471687921664,426062225,Lawrence shows what a good friend he is by making fun of Kot's depression. Someone's not being honest with his feelings. #AsTheLawrenceTurns
673312802816290816,497223799,I miss you it's been forever http://LINK
418604783222919168,103155656,My hammys are soooo fucking sore!!
449961733990645760,284223086,@SOMEONE i miss you already!!
706225154351824896,1644281526,Oh my lanta  yas you go wildcats  always killing it http://LINK
461511587686522880,1431455742,"Today is the official launch date for FrogSpeak, a student-run blog partnered with the RUOK? suicide prevention campaign. Check out their..."
425629530351341569,333242718,Seriously @SOMEONE I'm gonna kill you!!!
484939595671293952,310472518,Anxiety &amp; depression really fucking sucks. I'm a huge hardcore UFC fan &amp; I live In Vegas yet I can't get myself to go to join in on the fun
560630599736893441,2697409495,"#BeIlLetsTalk @SOMEONE did you know because if mental illness 800,000 people in North America commit suicide a year? @SOMEONE"
500667809798848512,1670882916,CAN  NEWS  http://LINK
559764947425456128,2279646556,"@SOMEONE Hey man I saw your depression vid. And about that, I need help. Can you, if possible, help me? Love your vids though"
611729538314166272,391501739,"Tell yo boyfriend to come get you , if he got ah problem I got twin pistols .. lol"
