msg_id,user_id,message
452999196770336768,238803204,Photo: be-cutfree-and-hope: Follow a depression blog with a little pinch of happiness. http://LINK
551228470232383490,2615643894,Mentally Ill Rikers Island Inmate Who Hanged Himself Was Supposed To Be On Suicide Watch http://LINK
500111180640165890,1287652903,Robin Williams and Why Funny People Kill Themselves http://LINK
461052570442559489,2177289643,Let's introduce #tonyabbott to #drsyme he needs some help with his political suicide #auspol @SOMEONE
480319175467220992,379549225,A bird just committed suicide by flying into my car... Glad to see we both feel the same about today
499256719877210113,64643056,UPDATE: Robin Williams committed suicide by hanging himself - Sheriff's office
450330860764790784,533986934,Mandla is gona commit suicide today lmao #BBMEviction
548326430929858560,232706669, tbh you stay exposing Jose &amp; I feel so bad for him but you're funny as fuck &amp; actually a sweetheart so
464415368254332928,353962105,Kenya Moore needs to seek help! She even talked over Peter @SOMEONE @SOMEONE @SOMEONE @SOMEONE
534417024236396544,331327364,So this is what depression feels like.
550073164966158340,1349787607,"If you are in crisis &amp; need help, the @SOMEONE runs a 24/7 suicide prevention line: 866-488-7386 #LeelahAlcorn #TransLivesMatter #NOH8"
429790417689661440,45977127,@SOMEONE @SOMEONE did i say anything on that foul? no so shut up.
583470575806451713,989789593,I never tell anybody how I feel bc in all honestly nobody gives a fuck!
452208121042440192,32058509,"So, I'm going to go with: by the end of season 10, Christina Yang is going to commit suicide. I'm calling it right now!"
463906946148360193,300614730,John Alan Lee pushes limits of Canada's assisted suicide debate - Health - CBC News http://LINK
498999326174375936,66289119,"Confirmed? @SOMEONE BREAKING: Actor Robin Williams died by hanging himself, source tells KTVU"
704451102230650881,95592094,"@SOMEONE Imo, I'm so moody. I don't mind them both like ""fuck her tonight."" As long as communication clear &amp; honest."
484346499954774016,234849013,@SOMEONE that's called addiction. You need to seek help.
472388656167411712,111366969,@SOMEONE @SOMEONE depends really. Had they declared their having depression beforehand? Could be discrimination but employment tribunal
519325072843366400,35013175,Never be too into your pride that u can't ask for or seek help when u need it. Sometimes people need people. It's ok. #wisewords
634224710348349440,2268501100,"How I spend all them years with a mf that dont even know how much he hurt me and fucked my head up,better question is why did I?"
465709483948130304,2459866106,@SOMEONE the fandom will always care about you with or without depression it doesnt matter if you feel sad we care
542870599488372736,2503654963,Ray Js Ex-Girlfriend Threatens Suicide After Break-Up [Photos] http://LINK
705547618965966848,2788520903,i literally hate garbanzo beans with everything in me
484829399573737472,223927431,the absolute lack of respect that people have fucking baffles me.
499379160435789827,2433533216,"Comedy great Robin Williams hanged himself at home: By Ann Saphir, Alex Dobuzinskis and Piya Sinha-Roy SAN RAF... http://LINK"
507809172717465600,1684753285,"Suicide: Every 40 seconds someone in the world takes their own life, a global tally of more than 800,000 suici... http://LINK"
523549869840302081,139604711,"Last tweet.. Since i haven't been through the suicide process my thoughts are ""ignorant"" and I'm uneducated about it?"
482221327080624129,742227680,@SOMEONE and then thinking about the fact that you're about to throw up is like mental suicide.
535253274975563777,2775746823,"None of you need to commit suicide. I would gladly help you with your ""problems""."
552649640055943168,623358456,If you need CPR I suggest you seek help elsewhere. #idontthinkitworksthisway #herfeetstink http://LINK
655793029006012417,2912598379,This bitch acting like she got a fucking peanut Brain 
487892556106444800,606803641,Odo al pasar: What people think depression is: Lazy What depression actually is: The feeling of... http://LINK
473902129321480192,1436256361,@SOMEONE so I ended up avoiding everything. Which wasn't right! I wasn't living. Then came the depression! It was horrible.
446444944958693377,260383375,Designer L'Wren Scott committed suicide by hanging: official http://LINK
660467841234243584,309921736,I had a dream I was fucking a nigga car because he broke my heart 
495267140812169216,112829942,"Billboard: *guy hanging into a cliff* ""Let go, I'll catch you"" - Jesus; o thought suicide was a sin?"
461593724896550912,577835257,Anorexic teenager who hanged herself in treatment unit had attempted suicide twice after cousin said over Sunday http://LINK
527840070720843776,30978898,I tried committing suicide the day I left home. My friend Teamer saved me. I'll never forget that. I called and she came. No questions 
504788205611130882,709191896,"In the late 19th century in Great Britain, attempted suicide was deemed to be equivalent to attempted murder &amp; could be punished by hanging."
461878868308410368,25843886,I hope whoever it is realizes how much they are affecting these people. You're the reason they may feel obligated to commit suicide... 
530554883590881280,432166283,@SOMEONE Dude makes a killing for just yelling
499006259279179776,142000370,Depression is a real condition. Depression is treatable. Please talk to someone. Don't take the only way out that isn't fixable.
499029454539472896,1403361636,Oh my god I can't believe Robin Williams died today I felt like I knew him  #RIPRobinWilliams
499204843555131393,574987077,papa died a few months ago robin williams died yesterday nd my dad went to the hospital because he thinks hes going to have a stroke AWESOME
389618583330123776,1585625738,Riley told everyone that scared her at the Haunted House to Pipe the fuck down and Can you not?
500822472330313728,2414125807,"Murder suspect Dewani's suicide bid: Businessman took overdose in weeks after new wife's death, psychiatric report reveals ..."
499442840791810049,2539416892,"Robin Williams hanged himself with belt, had cuts on wrist, coroner says - Williams remembered as brilliant, with a dark side - Are c..."
553344391705026560,2827220570,[suicide] LIKE I SWEAR IF MY HEALTH IS CONSTNATLY GETTING PUT OFF THEN IT'S JUST TIME TO FUCKING DIE TBHHHHHHHHHHHHHHHHHHHHHHHHHHH
506440904454840320,176075043,Suicide bomb blast kills 37 in western Iraq: Ambulances in Anbar province in Iraq scramble to the scene of a s... http://LINK
672470087559942144,462640499,If you could please tell me before I say fuck it and don't care that would be great
552757617953898496,153193593,At least 30 killed in suicide bombing at police academy in Yemen http://LINK
560228016585195520,561593173,I'd rather kill myself than commit suicide
634895289300725760,124254080,Not leaving but cutting way back. I just feel that I lost my place with most of you since I got sick.
705244532493967361,3434738661,@SOMEONE @SOMEONE @SOMEONE her name sounds like fucking cough syrup for christ sake 
502683053916160000,319676606,my trust is so fucked up .
359281642424115201,1136300857,New blog post - a Believe in Syracuse progress report. Read this blog that sums up our successes so far: http://LINK
544216754461749248,2402657372,For People Who Want To Help http://LINK
400460219446067200,65289597,I laid down for bed an hour ago but fuckin snapchat distracted me from sleep n I don't even like snapchat
474594847714594816,15029885,"Thank you, @SOMEONE for talking so candidly about coping w/ major depression. Everyone listen: http://LINK"
490662809634889728,346979858,Maybe people commit suicide because they're tired of feeling guilty of their burdens.
705964366387142656,931144800,So ready for tomorrow's fight!! Remember you can watch it live @SOMEONE #ufc196 http://LINK
433172725436145664,793970022,Iraqi suicide bombing instructor accidentally kills himself and pupils | via @SOMEONE http://LINK
402612386957238272,262434176,My cat just walks on my face like it's nothing.
549985152248451072,48889892,Is suicide a selfish act?://humanwithoutgod.blogspot.com/2014/02/is-suicide-selfish-act.html
500414760332972035,981763130,Most people who commit suicide dont want to diethey just want to stop hurting. #knowthesigns #speakup #helpothers #suicideprevention
499013318590595072,282278103,Sad to hear Robin Williams took his own life. . . R.I.P
531696625811746816,148073786,@SOMEONE True. We need to emphasise preventative care. You cant wait until youre collapsing from pain to seek help. Annual trips!
539316213135187968,2773645031,@SOMEONE @SOMEONE @SOMEONE @SOMEONE you need to Fuck off . There is you freedom of speech scumbag. It's burning the flag. Seek help.
510396671352913920,2352249061,a kid in lake mary committed suicide yesterday at his school campus due to bullying #resteasybuddy #suicideawareness
705550997482049537,28143046,Got me all the way fucked up.
482487995074088961,362999045,@SOMEONE http://LINK
500644577221431297,2325189097,VIDEO: Trapeze lessons 'help beat depression': Women suffering from depression are being encourag... http://LINK
415596344183492609,840888300,Furthest thing from perfect just like every that I know.
524428563773415425,406696226,No one commits suicide because they want to die. They do it to stop the pain. Or the voices.
499265489303240705,106327709,"""Comic actor Robin Williams apparently died of asphyxia due to hanging, Marin County Sheriff's Lt. Keith Boyd says."" via @SOMEONE"
509376154143559680,2601370835,@SOMEONE Grantland I hate auto correct
478201604240203777,338993684,If any of you suicide on me I will fucking bring you back to life just to kill you again.
553791106026975232,1397663454,Robin Williams couldn't have said it better. The worst thing in life is ending up with people who make you feel all alone.
527889480456617985,436316159,What stopped me from committing suicide was thinking of my enslaved ancestors and knowing that my worst day... http://LINK
704800646197858304,1385362632,WOOOO @SOMEONE FUCK OUTTA HERE 27 http://LINK
499259318135300097,2668972022,"Sheriff Official: Robin Williams Hanged Himself: (SAN RAFAEL, Calif.)  Robin Williams committed suicide by ha... http://LINK"
499007278037487616,221912006,"GOODBYE ROBIN WILLIAMS..ONE OF THE GREATEST AND BEST ACTORS..YOU WILL BE MISSED ..MAY YOU REST IN PEACE,IDOL...:("
490468813989638144,90552685,Someone could make a killing if they opened a breakfast delivery service.
477490778852556801,30430057,@SOMEONE @SOMEONE Yes. Depression affects people in different ways but the basic principle is always the same. You never feel like
518956610043928576,76288540,Suicide bomber kills five police officers in Russia's Chechnya: A suicide bomber killed at least five police... http://LINK
561795173634830336,114349089,So my phone committed suicide yesterday afternoon and well those that need to can get ahold of me on here I guess
499268552025600000,241502990,"Robin Williams ended his life the same way my father did, with a rope."
457223514601562112,1676003544,Michigan trooper-killer taken off life-support after suicide try http://LINK
555105324785733632,2599138458,How to Fight Depression with Fitness w/Amy Clover: http://LINK
663772537428553732,2368153948,"I hate when we text like """" but you tweet like """" like damn"
454702562201968640,128106685,In Memoriam to Self-Love Blogger Karyn Washington (And On Suicide Prevention): Sad news in the Blogger world.W... http://LINK
520225816857567232,1070705173,"White people commit suicide a lot because of depressing music. You can't think of killing yourself if U're dancing Sekem or Shoki na."""
542774128580001795,1447186687,I think far too many bad thoughts.
514714426025332736,2827598869,#quote Some people are addicted to anger. The only way they can relieve their depression and feel alive is by creating conflict.
466240647897575424,2177337757,@SOMEONE you need to contact the suicide help line - or tell the police you are so depressed. There is help out there
618659413059072000,746438736,I miss you way more  http://LINK
499259618418098176,10456852,"RIP Robin Williams, you'll be forever missed. I have so many favorites you were in, you'll be an angel http://LINK"
498981869384265728,2509100172,R.I.P. Robin Williams. We ALL will miss you so much. Glad your in a better place.
705420503285157888,617612793,"it's fucking iconic, and it was inspired by a lady professor in Cincinnati. women can do anything"
499056459875762176,444046087,ofgeography: robin williams died today. here is a list of things that robin williams was: funny sharp kin  http://LINK
705937572149792768,2969880305,"@SOMEONE Might be cool, won't necessarily be bad... and on that last one, what the fuck?! Surely you jest..."
499005815031091200,1155465373,Oscar-winning Comedian Robin Williams Dies at 63 so sad feel for families heart does out to then. No way to GO! http://LINK
554665634240294914,2343966386,Suicide bombing kills 12 people in Iraq http://LINK
433238420312186880,20583090,Julia Roberts half-sister died in a bath from an apparent drug overdose that's being treated as suspected suicide http://LINK
392273889411489792,98752257,@SOMEONE you don't see people's tweets about him. It's fucking bull shit. Everybody was hating on him before they knew he was dead.
666300657909927936,2352438206,*when pandora throws drake into my future station http://LINK
542853778529976320,401450556,"22 Vets die per day by suicide, but it's preventable. Sign the Suicide Prevention for American Veterans Act petition http://LINK"
467270117772890112,386879996,"""@SOMEONE ""We Lose A Sister Today. An EXO Fangirl Commited Suicide Because Of Kris' Leaving Issue"" -OverdoseEXO Global- Via: Lavina"""
518855512512012288,271156871,"&amp; that's the game, huge overtime win. I keep telling ya this isn't the same cowboys team you all love to hate. #cowboysnation"
672638925660364800,460597982,They cheated the fuck outta them but the throw was amazing.
499046412105965568,238086142,"If you need help: If you are considering suicide or know someone who is, please calla suicide hotline. They... http://LINK"
625319625773846528,257711103,Ashley wanna fuck me so bad ctfu
498471850050351105,66068118,"""@SOMEONE *inhales your opinion* *exhales the fuck i never gave*"""
499481184783437824,25482342,"Police confirm Robin Williams hanged himself, depression likely reason - Hindustan Times http://LINK"
706631957199917060,2917004893,@SOMEONE lmao I hate you  but bet definitely!
560461414762954752,282581409,#depression #overcomedepression #depressiontreatment #healthtips #depressiontest How To Overcome Depression? http://LINK
499243973873905664,782699606,Robin Williams found hanged at San Francisco home leaving no suicide note: Mrs Doubtfire legend's wife confirms: 'I lost my husband ...
552106952361115648,120507466,"Supplemental Health Care: ICU RN Needed ASAP (#Syracuse, NY) http://LINK"
550611510255706112,354997811,I'm tired of life. I used to remove suicide from my thoughts because of you. Now you make me think of suicide.
499405438618570753,357149990,I love comedy. I adored robin Williams. He loved tennis. I will miss him dearly one of the greatest comedic geniuses of our time. May he RIP
466685633130270720,352503585,@SOMEONE we are hanging out this week!!
485841716511903744,1957864448,"@SOMEONE NEWS: Slipknot, Danzig, Of Mice &amp; Men, Atreyu, Hatebreed, Suicide Silence, more announced for Knotfest http://LINK"
466672931028754432,153035186,@SOMEONE Yeah.. most people realized that there are easier ways of committing suicide. I have not heard of LSD for many years.. :)
509783116467425281,905445115,#ooc might need to seek help. I really can just fall asleep at the drop of a dime lol
445560170572046336,409277495,This wheelchair is killing my self confidence.
672563993697849344,2358201469,Kiyah hates when I call my boyfriend by his nickname !
521935720441585664,15888247,"House Call: When stuttering persists in children, seek help: If you stutter, you may find self-help groups to ... http://LINK"
507059412691722241,2278831477,"Having negative friends is linked to depression, lowered self esteem, insomnia and anxiety. Positive friends promote good overall health."
704722880194551808,2895505642,this kids gonna give me a fucking heart attack
486162051677831168,2214003641,"RT@SOMEONE ""If you sleep with dogs then you NEED TO SEEK HELP IMMEDIATELY http://LINK"
450225070947188736,154175456,Too early for this (@ St. Joseph's Hospital Health Center) http://LINK
561506320403406849,576628088,"Lol must be suicide ""@SOMEONE You on a died? @SOMEONE I don't remember eating anything today except drinking water """""
568221833809391616,499456921,@SOMEONE won't matter hahaha but ya I'd like to see it. Fuck Louisville
704733090015551489,11062352,Yelp fired a single mother because she wanted to be at the ICU caring for her boyfriend who had a terrible accident http://LINK
542342702260432896,183312191,"In San Jose, a lady tried 2 commit suicide. Had freeways shut down for hours. Let go, Let god. When vulnerable, drop to your knees n pray."
705227530861744128,618223856,i don't know what tk fucking do with myself
541677083366547456,412442705,@SOMEONE I want to travel the world. *throws you keys to private jet* go have a ball.
498971646989197313,866950921,Whyyyy Robin Williams  he was a hilarious man and actor. Gonna miss him! R.I.P. Robin
615321781625339904,378329890,"Something about her, probably cant live without her"
454604489153331200,1232901114,@SOMEONE I love that it's raining. It's like the world is mirroring my depression. My thoughts exactly
534773660373241857,515717590,It's was just suppose to be goddamn but I kinda like the goddammit tuesday 
443072892503212032,407419803,I can't take this anymore. My depression and anxiety is constantly eating me alive and I really want someone here with me now!!!
501558394042716161,1301083231,@SOMEONE ID RATHER KILL MYSELF THAN COMMIT SUICIDEsame
484317753356984321,2352823236,Iran: w#oman commits suicide by hanging http://LINK
500118039925641217,1649046241,Suicide Silence - Eyes Sewn Shut (8
432160233201627136,330748895,So hate the cold! #brrr
558289013035905024,39416045,I think I can attribute my release from depression to my mental strength &amp; prayer.. &amp; even then I'm still unsure on what delivered me
375959758458880000,31301332,"Up and at em breakfast and conf call, then killin it all day. Bless yourselves!"
499206848143048704,324492900,@SOMEONE Robin Williams -- Suicide By Hanging -- No Note http://LINK
619378535896059904,2227689703,@SOMEONE I fuck with your bio 
706358411710111745,408791289,I'm gonna make it through this year if it kills me
499643124197490689,1041541807,#USAHeadlines Did Robin Williams Battle With Spouse Susan Schneider Earlier than Chopping Wrists and Hanging S... http://LINK
466965000691908608,371567427,Just shut the fuck up and go back to pretending that I'm forcing you back into depression.
560460914105671680,2531103487,"#BellLetsTaIk been dealing with depression since I was 8 there are people who, don't belive, don't understand,or don't care #butnoteveryone"
562388696973213696,2260371499,the irony of saying someone is making ur depression worse so u ruin their life and make them depressed and miraculously u feel better
660874454772281345,3958251527,@SOMEONE you can get them yourself fuck boys 
476154955167203328,155294836," omg that part of the show got me balling ! My brother committed suicide , I feel their pain . It's still an open wound"
476478933727064064,1077857546,"@SOMEONE @SOMEONE Will this show also educate viewers on the harms of porn? Suicide rate, drug overdose and STD's?"
415663147962626048,1430808229,This movie straight up convinced me that Santa is real... Just like that... #iamabeliever
628384427572334592,883045890,I dont know why I be getting so mad over the dumbest shit part of me be like fuck him other half be like I'm wrong and it's not that serious
420063762079420416,1141462328,"Every time I see your name, I instantly get pissed. #fuckyou"
450859810461065216,2417941770,i hate insomnia and i hate depression
559302537137106944,479444314,THREE WOMEN COMMIT SUICIDE IN MORANG IN TWO DAYS &gt;&gt;&gt; http://LINK
436941763203194880,1890778339,HELP THE GUY I LIKE ASKED WHY IM TRANSFERRING SCHOOLS AND I TOLD HIM BC DEPRESSION AND MY MOM THOIGHT IT WOULD HELP AND HE READ IT FUCK
535296489971404800,2353481636,"Great story! Learn how QPR can save lives. Watch @SOMEONE ""Breaking the Silence on Suicide"" special this Thurs 10pm http://LINK"
489244125053460480,489172466,"I'm a suicide driver, Never been a liar, If I don't kill you later I'ma kill you Maana, You don't want no problems, You don't want no drama"
499253616436580352,325660106,Depression should not be taken lightly. RIP #RobinWilliams. Need a trusted professional to help you or a loved one? http://LINK
705047211097378816,611919400,I think the kid I hate is absent from A&amp;P
666779890067382272,1459730678,Happy year and a half anniversary. You're the missing piece that I was needing. baby I love you. We in this 4ever http://LINK
578597508429004800,66159484,@SOMEONE me fuckin too teen
499010749759774720,242917197,"It's really scary how someone like Robin Williams, who always seems so happy, can still want to take his own life."
466921886526754816,635169156,i hate sitting on chairs while wearing shorts bc chair marks
378957126720561152,39785654,Flowers on my walk that look just like an emoticon  @ 12 Corners Apothecary http://LINK
490770916553809922,1163272849,"If u say Good luck Jonathan won't be President in 2015. Just prepare ur suicide note, hanging urself won't be a bad idea after d elections."
398847933749424128,245060684,Some people are just so easy to hate
531954270313414657,2848518945,"For the first time in a long time I feel genuinely happy. After years of suffering major depression, I feel good today."
591823624329363456,1232818994,RIP JUST KILLED THE CLUB
633326004988047360,442939162,@SOMEONE well I don't fuck with you period't
448764135313276928,1562204551,"It's definitely spring depression. I hate almost everyone. Oooor, it's something else, but pretty much sure it's the former."
453049978877775872,376598043,Keeana. Shut up. Im trying to tweet about my depression.
447952069274918912,198572559,Foto: depression-take-me-away: B&amp;w depression blog. *trigger warning* http://LINK
614237331428651008,22784925,Gonna miss you so much next year  love you forever @ grad party http://LINK
540043730934591488,2840569235,"Carpe Diem. Seize the day, boys. Make your lives extraordinary. -Robin Williams"
661443075294670849,28215564,@SOMEONE just set alarm for like 1
705628817159630848,1410221689,@SOMEONE This Vet needs help NOW! http://LINK
626965264026877952,531822874,Everybody and they boyfriends cute tonight .
706226107272531969,229909902,I'm in that mood where I hate all 1500 songs on my iPod
468978025745219585,1626223500,"I'm not feeling good, fuck I need to get out of this depression it always makes me feel sick"
622406307753148416,90527960,#ErinsFace is holding down the Piffer in the parking garage while we proclaim community today! http://LINK
498983439740452864,346856526,#RIProbinwilliams so sad. Mental health is no joke! Seek help. Get help. Get God in your life and look up. #sosad
618660401740275712,443889367,Doin me do you ain't fuckin w niggas
497000121679093762,1309293318,Stem cell scientist found dead in apparent suicide - health - 05 August 2014 - New Scientist: http://LINK
457212851338612736,113818727,"Photo: suicidal-monsterr: devotedtothedemonsinside: suicide, sh, depressive &amp; advice blog - follow back... http://LINK"
501706129177841664,2543183917,#Health Parkinsons and depression: a common link  WKYC-TV http://LINK
653999771988951040,53195985,"@SOMEONE but I kinda hate seeing that. Pictures be up fast as hell. Days later it's that ""single"" post lol"
649760779760205824,227191218,"dawg the beats on ""Relapse"" were BANGERS i swear.. Em killed this album i think he was still on drugs for that album lol"
379339687535857664,59892795,Manning Bowl 2k13 don't fuck it up Eli
705050284708532224,2621487040,Republican party making it there mission to destroy Donald Trump the people will not let that happen we have the final say .so you told us
498983110659567616,1683772729,tumblr has made a joke of self harm and depression and honestly I think all social media sites should shut that shit down right now
531070761855762432,609713771,Officials: Suicide Attack Kills 8 in Northern Iraq: Officials say suicide attack in north Iraq on police convo... http://LINK
534099953409617920,464117425,Veronica needs to seek help and spend her time in a mental institution because of the picture she just posted
528646021984038913,247105352,"@SOMEONE ""on fleek"" is the most common saying for this these days. Aka I'm gonna commit suicide"
531699108340568064,1651919431,"In the late 19th century in Great Britain, attempted suicide was deemed to be equivalent to attempted murder &amp; could be punished by hanging."
523359290346586112,259608333,"@SOMEONE ""What does depression feel like?"" http://LINK"
705225286523232256,359610141,Y'all gonna stop playing with my emotions my heart dropped when the machines went flat I thought they killed Morgan #CriminalMinds
485588339014512640,182382018,I hate when she dies
484636263019196417,479382187,I feel like telling my client that I'm commiting suicide on the day of the deadline so he shudnt hold his breath.
547922556591046656,2842343170,Suicide attacks kill dozens in Iraq http://LINK
