msg_id,user_id,message
505000627991511040,21330040,@SOMEONE Patients with #depression benefit from #mindfulness-based therapy which leads to reduced health care visits http://LINK
504299831850848258,792795738,VIDEO | Dealing With Depression: 3 Top Tips for Finding a Mental Health Savvy Doctor | Watch: http://LINK
498973067700211712,42778165,"RT @SOMEONE If you or someone you love ever needs to talk to someone, the National Suicide Prevention Hotline is at 1-800-273-8255."
486141231748358145,43443830,@SOMEONE Agreed. :\ Idk how anyone thinks fantasising about being healthy is helpful. It just compounds my depression.
505193855319175168,2534701844,"Having negative friends is linked to depression, lowered self esteem, insomnia and anxiety. Positive friends promote good overall health."
559248779250266112,106763540,RT secretsfact: Over thinking ruins your ability to maintain a healthy optimistic outlook on life in general in which causes depression.
521898600834416640,2283901105,Color Therapy for Depression - HealthyPlace: http://LINK
501191256283021313,2599138458,Fighting #Depression with #Fitness: http://LINK
486346958118719490,2455084314,"Hey r/depression, any advice? Especially people in the UK http://LINK"
469612472383856641,1707670856,I reblogged something on tumblr: flowing-tears-pouring-rain: depression blog http://LINK
449497413540405248,756808976,Zdjcie: depression-take-me-away: B&amp;w depression blog. *trigger warning* http://LINK
501155272786989056,39068440,@SOMEONE Personal blog in honour of @SOMEONE forever missed. Please RT to get people talking #Depression http://LINK
558553804346753024,1616997456,Depression Assist: Why don't a lot more evangelicals identify the as well as theological issues... - Patheos (blog) | http://LINK
529698873464213504,194201383,Big thanks to @SOMEONE for a real &amp; compassionate @SOMEONE interview with @SOMEONE on depression &amp; mental health.
443528314498850817,125029152,When people laugh and joke about depression and mental health issues it bugs me so much; not a laughing matter one bit ugh 
502478122852581376,2466523579,Want to learn how you can reduce your symptoms of #depression through #mindfulness? Here's my advice! #mentalhealth http://LINK
471275555711885313,2342347670,Oxford CBT now offering... #online therapy #skye therapy for #anxiety #depression #panic attacks . Free initial advice. Please RT
528256750156525569,58795534,"Profound blog &amp; solution map for Physician #Suicide by Pamela Wible, MD, well-attended session @SOMEONE http://LINK"
521103388344201216,215241329,"Robin Williams's Daughter, Zelda, Urges Others to Seek Help on World Mental Health Day http://LINK"
482767645138485248,2649168411,"Hugging is healthy; it cures depression. Reduces stress. &amp; induces sleep. Hugging is also all natural, its organic; naturally sweet."
435062058972114944,2317899203,"Such a wealth of #knowledge on here, loving reading peoples #blogs and advice for suffers of #mentalhealth #depression #stress &amp;#anxiety"
563742987478642689,3009938674,If anyone wants any advice on how to deal with depression just message me on dms as I've proudly got through years of utter shit
542338651447771138,1604960918,"#health - Abnormalities Found in Brains of Young Bipolar Patients Who Try Suicide: TUESDAY, Dec. 9, 2014 (HealthDay http://LINK"
478793323918811137,55548061,Its all in the control group: wait-list may boost the efficiency of CBT for depression: This blog should set ... http://LINK
441232927385341952,45717101,"Remember, the ppl you post about are real. Web bullying (even for the sake of comedy) is real. And suicide is real."
475569442064457728,15052353,Just Blogged: Why Dynamic Typing in SharePoint is Suicide http://LINK
486151267765731328,29979814,It's Minority Mental Health Awareness Month. Grateful for 2 great therapists I've seen over the yrs who helped me w depression #NoShameDay
505570292580618240,1269223392,"Having negative friends is linked to depression, lowered self esteem, insomnia and anxiety. Positive friends promote good overall health."
490845570911596546,709373785,"#Health: I've ditched happy pills for flower power: After battling depression, one star goes against the docto... http://LINK"
481532967387676672,251245578,Foto: depression-take-me-away: B&amp;w depression blog *trigger warning* http://LINK
556833986534998016,15081705,Health &amp; Happiness Hour with Rob Ellen 14 January 2015 Health &amp; Happiness Hour with Rob | No Depression http://LINK
482547731785711617,814505048,#Speedy 'A view or a life?': Suicide barrier debated http://LINK
501694189696851968,363153127,check this out Mara Wilson Has Written A Blogpost About Robin Williams And It's Lovely: We... http://LINK
498971771651895296,563320765,"Robin Williams in long list of brilliant artists who suffer depression, commit suicide. Sad beyond words. Health care fails mental illness"
507335257100939264,371591017,Now Playing On PAWS Web Radio Manic Depression - Jimi Hendrix
481811693941821440,216684970,@SOMEONE @SOMEONE @SOMEONE @SOMEONE @SOMEONE please read #mentalhealth #blog #suicide http://LINK
499258521918394369,59015776,"""@SOMEONE ""Watch out for rampant senators."" advice from Robin Williams when I was a congressional Page in09 http://LINK"
458331151405289472,2291548064,@SOMEONE Haha I felt the exact same way when I read her webcomic. Particularly the Depression ones.
457506355646332929,364420117,Foto: be-cutfree-and-hope: Follow a depression blog with a little pinch of happiness. http://LINK
446222862584918016,488851274,@SOMEONE thanks for the advice if I need anymore suicide tips I'll let you know
507219948692054016,2599138458,Depressed? Try Exercise: http://LINK
491392046033534977,2599138458,How to Fight Depression with #Exercise: http://LINK
555787941797036033,1054299570,Arts critics do not romanticise suicide - The Guardian (blog) http://LINK
453642479179288576,315448775,"""@SOMEONE Blogging helps teens &amp; young adults deal with social &amp; emotional stress. Sites like #Tumblr can help relieve depression."""
495121851581227008,2477089009,"The top 3 health-related Google searches on the Internet are (in this order): Depression, Allergies, &amp; Cancer."
507687949048086529,23917576,One person commits suicide every 40 seconds: World Health Organisation http://LINK
473746756178812929,82052345,Get To Health Aerobic exercise has been shown to relieve depression. As you exercise your body releases endorphi... http://LINK
480598650515513344,1549184826,How to Fight Depression with Fitness w/Amy Clover: http://LINK
484040010413666304,388892233,"Finally  Golden Gate Bridge Suicide Barrier Approved - For decades, mental health advocates in the community ... http://LINK"
563420737138991104,28662271,Shooting on campus at USC in School of Public Health building on Assembly is confirmed murder-suicide. No further threat to others.
492402593797132288,1525396392,Behavior therapy may help prevent depression over vision loss: NEW YORK (Reuters Health) - Combining occupatio... http://LINK
438160925455970304,33704103,"I don't do lightly with depression, anxiety and any other mental health disorders. And if you can laugh at someone who has these, goodbye."
512086762177716224,102710431,Yay&gt;@SOMEONE RT Thoughts on Suicide From This Bipolar Chick http://LINK
549271156495515648,2695796792,May 2014: We acted for mum of 17 yr old Michaela who comitted suicide whilst under care of mental health services http://LINK
547909382466318336,51811959,13 Healthy Foods That Reduce Stress And Depression - http://LINK
442387205051252737,320726488,If You Have Depression During Pregnancy You Should Follow This Advice http://LINK
460389510388654080,2334809670,[ Mental Health ] Open Question : How do you fight through depression? http://LINK
548098301740859392,304981926,"""@SOMEONE Too much homework has a negative impact on a person's memory as well as overall health. Also leads to clinical depression."""
447810386784690176,1848329648,Foto: depression-take-me-away: B&amp;w depression blog. *trigger warning* http://LINK
497428194593886208,910813375,Mindfulness Therapy is as good as antidepressant drugs for #DEPRESSION. Read this CNN Health article on http://LINK
521852815522549760,2790361134,Robin Williams' Daughter Zelda Addresses 'Misconceptions' About Mental Health - ABC News http://LINK
548807408315691008,332702581,I like a blog Easy tips to beat DEPRESSION on http://LINK
508945921074135040,1865655091,"Was missing Alice Gross bullied on suicide scandal website Ask.fm?: Alice Gross, 14, was last seen walking alo... http://LINK"
508223094779961344,791553619,Mindfulness-based depression therapy reduces health care visits - http://LINK
453185558278205445,2346118556,Hearts and Minds: Depression Increases Heart Failure Risk by 40 Percent http://LINK
539162089810841601,1017317580,"FREE webinar ""Top 6 causes of stress, depression &amp; burnout in Veterinarians"": Wed 10 Dec-1pm (Qld). http://LINK"
546681765579202561,18775482,Learn more about this suicide prevention ministry on our webpage below &amp; join the cause! http://LINK
463476242960773120,50590939,#Health VIDEO: 'Helmet' used to treat depression: Danish researchers say a helmet that delive... http://LINK
477424192040624129,726368071,"Reducing risk of suicide: advice &amp; resources for relatives &amp; friends, professionals &amp; those at risk http://LINK"
451489846188462080,963152304,Mindfulness Therapy is as good as antidepressant drugs for #DEPRESSION. Read this CNN Health article on http://LINK
501809283517149184,1513908974,Suicide prevention with the help of Director of Mental Health Am - Hawaii News Now - KGMB and KHNL http://LINK
512941751732944897,2741397992,"#Healthy #Fitness 'Too Skinny': Teen Boys' Body Image Linked With Depression, Steroid Use, Study Finds http://LINK"
537559382616465409,2696760445,Deals : http://LINK
474909546599571456,18860887,"Check out ""web 2.0 suicide machine promotion"" on Vimeo http://LINK"
564863854744571906,2597174971,#depression #hairstylebyme Easy #home surveillance: http://LINK
539236287287681024,2599138458,How to Fight Depression with Fitness w/Amy Clover: http://LINK
448556383537876992,1282150147,Suicide Prevention Training Sessions Planned on Maui: The state Department of Health is sponsorin... http://LINK
556541076669235201,100842429,"Woman Commits Suicide after Son Caught her in Bed, doing it with co-worker... http://LINK"
455844797321084930,345747362,"Foto: heartlessintheworldofhearts: Depression, SH, ED &amp; suicide blog. http://LINK"
532590567390470146,1969369357,@SOMEONE you should seek help from a medical professional because that is not healthy
504996914073726977,340996448,RT @SOMEONE Tues' #Psychology #Tips: Simple #Depression Busters http://LINK
516827290656063488,494218299,"New Blood and Urine Tests Find 5 Distinct Types of Depression, Researcher Says via @SOMEONE http://LINK"
530441519728451584,324841951,Some blogger's could make one commit suicide
492871682978107392,2660395429,Depression is a chronic illness that exacts a significant toll on America's health and productivity.
508173115776835584,322048409,If a mental health organisation thinks that depression is about being miserable &amp; people should smile more then we have a big problem!
499323515808792576,222089194,"""@SOMEONE Samaritans' suicide reporting advice and the front page of the Daily Mail. - http://LINK"
560642421999284224,269170900,.22 Afgan &amp; Iraq vets commit suicide every day. Eliminate barriers to quality mental health care for vets! Petition: http://LINK
533615435355521024,219687233,"Labradigor's post in Depression, Mental Health Advice, and Support http://LINK"
533511076927651840,14681336,What can we learn from Robin Williams in life and in Healthcare http://LINK
498996707779440640,793190844,"As someone who suffers from depression: in a twisted way, it's nice to see everyone start to give a shit about mental health because of RW"
532709981921882112,436748991,Today's Health Highlights: Robin Williams Had Type Of Dementia That Causes Hallucinations &amp; Other Stories - http://LINK
499741782977298432,2439556818,#Health Robin Williams dead of suspected suicide: Are comedians more plagued by   Fox News http://LINK
505690993891352577,2558678089,@SOMEONE This is a bulgarian suicide hotline if you need to talk to someone Sofia Hotline: 0035 9249 17 223
450052431393456129,45862526,"1 Year After Sons Suicide, Rick Warren Hosts Gathering on Mental Health and theChurch http://LINK"
474568621067628544,216744446,This website has some very good resources for anyone worried about someone with thoughts of #suicide http://LINK
502108809729683456,1348560126,Helpful Advice About Depression For You And Your Loved Ones - http://LINK
497947674872926209,82312640,Photo: Follow a depression blog with a little pinch of happiness. http://LINK
508174673415122945,37590423,"@SOMEONE Pls help &amp; share my blog/story on my fight/survival with #Bulimia, #depression ,&amp; #Suicide http://LINK"
553688827047317504,471670391,Keep Fighting: Tips And Advice For Your Depression http://LINK
499030445859041281,1353184454,"Robin Williams death is tragic, but it highlights some very real, very scary problems that need to be addressed in American mental health."
564032370152452096,414391772,#Healthy #Nutrition How to Lose Body Fat and Depression at the Same Time: Fight Depression by Fighting Fat and Ge http://LINK
520128043416031232,2285315834,Free private treatment for anxiety or depression - Hugh Macnab | http://LINK
433283901818036224,970770608,What will #Obama's legacy be? a) spike in suicide rates b) historic EBT/Foodstamp usage c) a broken economy d) collapsing our healthcare
445632624560967680,316526690,Photo: razor-blood-hello-love: black &amp; white depression blog ~trigger warning~ http://LINK
441631973011111936,40361027,The Ted Clarke Trust working with PIPS Charity are hosting a Suicide and Mental Health Awareness Evening at Shamrock Pk on Friday 14th March
542027294772977664,2720322858,A Surprising Treatment For Depression That May Be Just As Effective As Talking To A Therapist http://LINK
499018849019105281,117543168,"Given todays events: if anyone is contemplating suicide, please go to http://LINK"
458110773047214080,126803141,My blog post Married to Depression is going to be in an anthology for a charitable cause. http://LINK
539160449133338624,885979160,any advice for people who are struggling with depression or self harm? x74 @SOMEONE
540591392603791360,2328288001,A new way to treat depression - Forum:Blog Forum:Blog | The World Economic Forum http://LINK
517073771811713024,393683887,"#Depression Is Not One-Size-Fits-All, And Neither Is The Treatment http://LINK"
548732690191888384,2719468110,Beauty Hot Deals: http://LINK
487328102088204288,253314230,"@SOMEONE #CrazyGoodSummer if you could give someone with depression advice, what would it be?"
440372650037489664,99821411,@SOMEONE I'm serious talk to some sense into them I'm tired of Knicks fans on suicide watch
560590302302703616,864050497,"Suicide is a scary thing to think about, but for some people its the only way out Help donate to raise mental health awareness #BelLetsTalk"
552027364297695232,344919252,"Depression the modern life reality (Promoted Health Initiative): People tend to feel sad, depressed when they ... http://LINK"
541985264927666176,67683358,"On Robin Williams, mental health advocacy, &amp; small gestures of comfort: http://LINK"
505403774266253312,755356525,"'Robin Williams: A Spark of Madness', A Web Comic Depicting Williams' Life as a Video Game http://LINK"
456031521690775552,411284614,SUICIDE ALERT: 22yr-old Motivational Blogger Karyn Washington Commits Suicide (PHOTOS) ~ Naija... http://LINK
486543588848041985,549394806,so i saw this website that said what are the thingies of depression and there were 30 and i just wondered what they were. i have 28/30 :/
506143063904124928,150890018,"being negative &amp;lazy is a disease that leads 2pain, hardship, depression, poor health &amp;failure. be proactive, &amp;give a damn 2achieve success."
538414604708499456,1941945739,5 signs of depression?! http://LINK
528969423651340289,353965367,Foto: just-a-scratch-just-a-scar: bands/depression blog{credits to the owner} http://LINK
499559767996497920,626866516,"(#TeamExotic) At War Blog: Williams Opposed War, but Supported the Troops: Robin Williams went above and beyon... http://LINK"
484813473621090305,2150625354,Solid Advice Concerning How To Remove Depression http://LINK
478979033640620032,1152359449,10 Healthy Ways to Increase Happiness in Teens #happiness #depression #teens #parenting http://LINK
499379599814688768,52164275,Sheriff Reveals New Details of Robin Williams Suicide - Yahoo! Voices (blog) http://LINK
505505478831779841,2469049272,"#Movie Web page 2: Robin Williams, Die Onerous, Strolling Lifeless, Paddington, RoboCop, Ghostbusters, Kubrick http://LINK"
499625374817325057,967455648,Popular Blogger Pens Viral Post Calling Robin Williams' Suicide a 'Choice'  He... http://LINK
485390153775472640,1348560126,Staying Healthy To Help You Deal With Your Depression - http://LINK
500252520363466755,579310238,"Mara Wilson Blogs About Robin Williams: ""There Is No Question He Had a Great Impact on My Life"" http://LINK"
499509672240365569,3078921,Apple Pays Tribute to Robin Williams: Apple today features a tribute to Robin Williams on the company's websit... http://LINK
499673531567726592,15676413,"Today someone referenced my :(-ness story as being abt ""one user's experience,"" like depression is an app or website. I LOVE THIS SO MUCH."
510495580066697216,73397800,Newsbeat has been nominated for a #MindAwards for its coverage of mental health issues &amp; @SOMEONE suicide doc. Well done @SOMEONE
474982596435509249,26068537,Check out new blog post on depression http://LINK
513592382240346112,226695189,#Suicide prevention a health priority: Harsh Vardhan - Daily News &amp; Analysis http://LINK
515212204941918208,475399977,I've started medication for my depression and it's really helping. Would you all be interested in a blog about my experience?
500292917978619904,504731972,Robin Williams: His advice still matters: Robin Williams gave a lot of advice. Whether in character or as hims... http://LINK
475784358901862402,2419698020,@SOMEONE This blog could help someone with depression.. #NotAlone http://LINK
561384167795982337,1479550394,"'Skype plan' for mental health care: A health trust's proposal to treat patients with depression by using ""sta... http://LINK"
494826739055726593,2326358611,#Insomnia: A Healthy Response to #Depression? http://LINK
548633121684717568,948094740,Living With Depression? Try Following This Advice! - http://LINK
528302414676635648,273359101,Eko's Voice Blog: Police Officer Commits Suicide http://LINK
455917236360720385,919572307,Online Help for Depression - Talk to a Therapist Online via Skype: http://LINK
484192807502872577,109607957,Depression May Be Linked to Heart Failure  WebMD http://LINK
500579417412747264,2724845083,Simmons speaks out on depression comments: Gene Simmons insists his heart goes out to anyone suffering from de... http://LINK
522851493209059328,1535885678,"#Health #Solution 'Too Skinny': Teen Boys' Body Image Linked With Depression, Steroid Use, Study Finds http://LINK"
475752059195494400,2555526734,@SOMEONE @SOMEONE TOUGH LOVE...MAKE SURE YOU REST WITH YOUR DOOR LOCKED....CRISIS HOTLINE ADVICE LADIES   thank you
443992426282106880,204233250,"Long term and intense anger has been linked with mental health problems including depression, anxiety and... http://LINK"
545619503070339072,437971866,#Oklahoma Sen Blocks Funding for #Veterans #Suicide Prevention Web Site - http://LINK
492245455179247616,607469339,"@SOMEONE Work at a hospital w/ patients with altered mental statuses - Dementia, suicide attempts, drugs/alcohol, mental health, etc"
524603801689288705,178019251,"In 4 weeks - Mental health behind bars: health needs, suicide, risk and self-harm (#free) - http://LINK"
438117632366366720,17942023,@SOMEONE same here with the depression. I know I am happier without it. More stable mentally and literally.
447388577953878016,890229985,Why You Should Meditate: http://LINK
513296471836598272,19681303,".@SOMEONE @SOMEONE @SOMEONE Mental health? I suffer from depression, and I have Aspergers syndrome. Anyone who knows me..."
550460625185673216,2599138458,Fighting #Depression with #Fitness: http://LINK
517747573030158336,463428299,"Set de fotos: coyocoyo: ""Sometimes I Get Sad and I Dont Know Why"" WebMD Suicide Prevention Line Guide to... http://LINK"
463323607494426624,160907805,yuppp RT Fact: Too much homework has a negative impact on a person's memory as well as overall health. Also leads to clinical depression.
522205442194571265,2180943150,we're talking about suicide in health and the teacher makes it so uncomfortable and triggering its scary
533301368367628289,2455432572,Soldiers at increased suicide risk after leaving hospital 0 BY NATIONAL INSTITUTE ON MENTAL HEALTH ONNOVEMBER... http://LINK
524385744526143488,226469529,50+ Tips for Self-Care from 35 Mental Health Experts Gonna go read this now. #PHAware #PHnMentalIllness #Depression http://LINK
439525895397990400,132390780,Foto: be-cutfree-and-hope: Follow a depression blog with a little pinch of happiness. http://LINK
509042719164219392,17388861,How Can We Get a Grip on the Global Suicide Problem? - The World Health Organization has released its first ever r... http://LINK
519945460736593923,2356088064,Research:Those with the highest levels of Vit D less likely to develop depression than those with lowest levels. #health #fitness
462374411996520448,162704698,Pearl Jam 'World Wide Suicide' #nowplaying on #ZanZanA #WebRadiO (http://LINK
555470173457879040,385468240,Yoga for Anxiety and Depression - Harvard Health Publications http://LINK
509918073525006336,89653545,Today is #RUOKday. Help encourage good mental health and prevent #suicide - ask your loved ones this simple question! http://LINK
436534981930647553,497554467,"Motherlode Blog: Zacharys First Shiva: At 9, my son may be young to hear about suicide, or maybe he sh... http://LINK"
525750188632457216,81496049,No healthy person would murder people they know then commit suicide. The kid obviously had some unaddressed mental health issues.
511190976539262977,2251116787,Robin Williams Movies Make Comeback On ITunes VOD Top 15 Chart - Indie Wire (blog) http://LINK
462803817361588224,253016489,Over thinking ruins your ability to maintain a healthy optimistic outlook on life in general in which causes depression.
537243603160944640,2802141664,"The candida and depression -How yeast leads to depression,anxiety,ADHD,other http://LINK"
564882397766766592,3009247090,"I told you not to tweet to me.However, if you are suffering from loneliness or depression and want to talk to someone,then it's OK"
553486347051499520,130467057,Depression/Grief. The seven steps of grief over loss of health http://LINK
482547022755790848,66771143,Photo: xcrashedbrains: depression blog http://LINK
548478685943431169,2809127089,I just need to vent. I need to talk to someone. via /r/depression http://LINK
462237952543064064,2177828341,#ff @SOMEONE @SOMEONE @SOMEONE Please RT &amp; Help increase Mental Health Awareness &amp; Suicide Prevention - http://LINK
481415028923301889,88366277,"Doctors' health at risk from stress: Suicide rate is twice as high among doctors as general population, and di... http://LINK"
545342224452845568,1250738478,foxycum: trigger-incoming: This website is like a suicide hotline but with text chat instead. I... http://LINK
435063326385913856,313872876,"@SOMEONE where were you when Hershel was executed, and did you seek medical advice for slight depression since the incident?"
560697396750196736,27348178,@SOMEONE Would mean so much to me if you could read this blog I wrote about my life with depression. http://LINK
449716978056724480,2310889543,LATEST BLOG ENTRY: Pay It Forward #mentalhealth #depression #anxiety #compliments #social #people ---&gt; http://LINK
560628374289543169,1542198810,"Having fought depression all my life, hospitalized twice, it's nice to see Mental Health being discussed. #BellLetsTalk"
475940569861357568,28316439,What a brave couple on #thismorning talking about their daughter's suicide :-( Hopefully gets more people talking about mental health issues
506294494086443008,2599138458,Fighting Depression w/ Fitness: http://LINK
489235600709390337,1969040304,Why Depression is Not Like #Diabetes http://LINK
497230272149356544,2194041175,@SOMEONE camila please give some advice for your fans who suffer from depression? #askcamila t
540242596665106432,2316117703,"Join the LHS Health Action Network's Courageous Conversation tonight in the Lincoln Library at 6:30pm. The topic is ""Suicide Prevention."""
463328258344644608,2196471134,#Desayunando #Healthy #Fat #Suicide http://LINK
457235184732364801,2362836910,@SOMEONE people's bipolar of cork mental health and teen bullying site suicide prevention support if only a chat
553202521918169088,52834921,"#health Gut bacteria, prebiotics and the link between helping stress, anxiety and depression http://LINK"
507454284409995264,1557821946,"North Korea's suicide rate among worst in world, says WHO report: World Health Organisation study entitled Pre... http://LINK"
508181084161314816,37590423,"@SOMEONE Pls help &amp; share my blog/story on my fight/survival with #Bulimia, #depression ,&amp; #Suicide http://LINK"
511039152914432000,253003139,Over thinking ruins your ability to maintain a healthy optimistic outlook on life in general in which causes depression.
484449775207845888,2599138458,Fighting #Depression with #Fitness: http://LINK
