msg_id,user_id,message
559821402518609920,15408931,NIMH  Webinar Series - Suicide Prevention: An Action Plan to Save Lives http://LINK
509683697189408768,2433352716,The Jed and Clinton Health Matters Campus Program: Promoting Mental Health and Preventing Suicide and Substance Abuse on College Campuses...
526054404882178048,273359101,Eko's Voice Blog: How a song saved me from Comitting suicide'- Fast Rising singer Open Up! http://LINK
456385865715965952,1881312661,"@SOMEONE that sounds like you are on a suicide mission. money has only a mathematical value, but health and happiness has no $-sign"
514143408227889152,378768737,Study links sedentary behaviour to higher risk of depression #health http://LINK
